{"case_id":"C030","maintenance_needed":false,"confidence":99,"change_types":["formatting and file-mode cleanup","type-cast and numeric-type corrections","decoder-internal implementation fix","encoder-internal implementation fixes"],"affected_functions":["DecodeMetaBlockLength","ConstructHuffmanCode","ShouldCompress","BrotliEncoderCompressStreamFast","Log2FloorNonZero","Store","BrotliIsMostlyUTF8"],"reason":"No fuzz-harness maintenance need is introduced. The only decoder changes exercised by this harness are formatting in DecodeMetaBlockLength and an internal cast in ConstructHuffmanCode; neither changes the decoder entry point, protocol, initialization, state requirements, configuration, or input constraints. The remaining behavioral changes are confined to encoder internals, which are outside this decoder-only harness's established scope, and do not constitute a new decoder feature or entry point requiring adaptation.","evidence":["The harness still creates a BrotliDecoderState with BrotliDecoderCreateInstance(0, 0, 0), feeds arbitrary bytes incrementally to BrotliDecoderDecompressStream, and destroys the state with BrotliDecoderDestroyInstance.","The DecodeMetaBlockLength diff only wraps existing exuberant-nibble conditions across lines; its logic is unchanged.","ConstructHuffmanCode adds an explicit HuffmanCode cast without changing its signature, callers, or externally controlled inputs.","Changes in BrotliEncoderCompressStreamFast, encoder ShouldCompress functions, hash storage, logging tables, and UTF-8 detection are encoder-side internals; the existing target and build wiring explicitly fuzz and link the decoder path.","No new public API, decoder option, required initialization, state transition, configuration, or restricted input format appears in the supplied diff."],"recommended_action":"Keep the existing decode harness unchanged; no maintenance is warranted by this commit."}