{"case_id":"C004","maintenance_needed":true,"confidence":98,"change_types":["new public decoder entry point","new stateful API protocol","attack-surface expansion"],"affected_functions":["wuffs_gif__config_decoder__initialize","config_decoder.decode_image_config","config_decoder.decode_frame_config","config_decoder.ack_metadata_chunk","config_decoder.restart_frame"],"reason":"The commit adds a distinct public GIF config_decoder implementing base.image_decoder, with its own parsing implementation and call-sequence states. The existing GIF harness only initializes and drives wuffs_gif__decoder, so it does not invoke this new decoder type or exercise its metadata acknowledgement and restart protocols. The wildcard OSS-Fuzz build only compiles existing *_fuzzer.c files and therefore does not create coverage for the new entry point automatically.","evidence":["The new source declares `pub struct config_decoder? implements base.image_decoder`.","The new decoder defines a multi-state `call_sequence` protocol involving `decode_image_config`, `ack_metadata_chunk`, `decode_frame_config`, and `restart_frame`.","The existing `gif_fuzzer.c` constructs only `wuffs_gif__decoder dec` and calls `wuffs_gif__decoder__initialize`, `decode_image_config`, `decode_frame_config`, and `decode_frame`.","The new `config_decoder.decode_frame` returns `base.\"#unsupported method\"`, confirming that its intended config-only path differs from the full decoder path exercised by the existing harness.","The OSS-Fuzz build loop creates targets only from `fuzz/c/std/*_fuzzer.c`; no config-decoder target is present in the supplied harnesses."],"recommended_action":"Add a fuzz target for `wuffs_gif__config_decoder`, or extend the GIF harness to select it, and drive its supported image/frame configuration operations plus metadata acknowledgement and restart state transitions using fuzz-controlled input and options."}