{"case_id":"C104","maintenance_needed":false,"confidence":99,"change_types":["compiler_compatibility","conditional_compilation"],"affected_functions":["BrotliBsf64Msvc","BrotliBsr32Msvc"],"reason":"The commit only raises the MSVC version threshold from 12.0.0 to 18.0.0 for including <intrin.h> and selecting MSVC-specific bit-scan/count macros. It does not change decoder functionality, the BrotliDecoderDecompressStream API, initialization or state requirements, configuration exposed to fuzz input, or input constraints. The existing harness continues to exercise the same high-level streaming decoder path adequately.","evidence":["All three production changes replace BROTLI_MSVC_VERSION_CHECK(12, 0, 0) with BROTLI_MSVC_VERSION_CHECK(18, 0, 0).","The changed branches concern <intrin.h>, BROTLI_TZCNT64, BrotliBsf64Msvc, and BrotliBsr32Msvc; no decoder entry point or protocol is modified.","The harness already creates a BrotliDecoderState with BrotliDecoderCreateInstance and feeds fuzz-controlled data through BrotliDecoderDecompressStream in both fast and chunked decoding paths."],"recommended_action":"No fuzz-harness update is required; retain the existing decoder harness."}