{"case_id":"C001","maintenance_needed":false,"confidence":98,"change_types":["internal bit-reader representation refactor","decoder implementation change"],"affected_functions":["BrotliInitBitReader","BrotliWarmupBitReader","BrotliGetAvailableBits","BrotliFillBitWindow","BrotliPullByte","BrotliGetBitsUnmasked","BrotliDropBits","BrotliBitReaderUnload","BrotliCopyBytes","BrotliDecoderDecompressStream"],"reason":"The commit reverses the internal meaning of bit_pos_ and adjusts accumulator loading, consumption, and unloading accordingly, but it does not add a decoder entry point, alter the public streaming API, require new initialization or configuration, or impose a new input protocol. The existing harness already drives BrotliDecoderDecompressStream with arbitrary data and both whole-input and fragmented-input delivery, so the changed internal bit-reader functionality remains exercised through the relevant high-level path without harness maintenance.","evidence":["The harness creates decoder state with BrotliDecoderCreateInstance(0, 0, 0) and invokes BrotliDecoderDecompressStream on fuzzer-controlled bytes.","The harness explicitly tests both fast delivery (addend == size) and slow fragmented delivery (addend <= 7), including repeated NEEDS_MORE_INPUT and NEEDS_MORE_OUTPUT behavior.","All changed identifiers are internal bit-reader operations in c/dec/bit_reader.c and c/dec/bit_reader.h; no public decoder function signature or calling requirement changes.","BrotliInitBitReader, BrotliGetAvailableBits, BrotliFillBitWindow, BrotliPullByte, and BrotliDropBits are changed consistently around a new accumulator representation, indicating an internal implementation refactor rather than a new externally selectable feature.","The added BrotliBitReaderLoadBits helper is reached through existing decoding operations and introduces no separate entry point or harness-controlled state."],"recommended_action":"Keep the existing decode_fuzzer unchanged; no new target, initialization, configuration, or input construction is justified by this diff."}