{"case_id":"C113","maintenance_needed":true,"confidence":99,"change_types":["new public API entry points","new output formats","new configuration options","attack-surface expansion"],"affected_functions":["plist_write_to_string","plist_write_to_stream","plist_write_to_file","plist_print","plist_write_to_string_default","plist_write_to_string_limd","plist_write_to_string_plutil"],"reason":"The commit adds a substantial serialization surface that the existing parser-only harnesses do not invoke. The harnesses stop after plist_from_bin or plist_from_xml and plist_free, so they cannot exercise the new format dispatch, write options, output-size estimation, recursive node serialization, or stream-writing implementations.","evidence":["bplist_fuzzer.cc only calls plist_from_bin(data, size, &root_node) and plist_free(root_node).","xplist_fuzzer.cc only calls plist_from_xml(data, size, &root_node) and plist_free(root_node).","The public header adds plist_write_to_string, plist_write_to_stream, plist_write_to_file, and plist_print.","The new plist_format_t introduces PLIST_FORMAT_PRINT, PLIST_FORMAT_LIMD, and PLIST_FORMAT_PLUTIL, backed by three new output-only serializer files.","The new plist_write_options_t exposes PLIST_OPT_COMPACT, PLIST_OPT_PARTIAL_DATA, PLIST_OPT_NO_NEWLINE, and PLIST_OPT_INDENT, including a fuzz-controllable indentation level.","plist_write_to_string dispatches among XML, JSON, OpenStep, PRINT, LIMD, and PLUTIL implementations, none of which is reached by the shown harnesses."],"recommended_action":"Extend or add a harness that obtains a valid plist tree from fuzz input and invokes plist_write_to_string across the supported formats and fuzz-controlled option combinations, freeing returned buffers with plist_mem_free. Also exercise plist_write_to_stream with a safe temporary or memory-backed stream if practical; avoid arbitrary-path testing of plist_write_to_file."}