{"case_id":"C077","maintenance_needed":false,"confidence":99,"change_types":["internal traversal refactor","resource cleanup"],"affected_functions":["TY_(BQ2Div)","TY_(FixLanguageInformation)","TY_(FixAnchors)","StyleToHead","TY_(CheckHTML5)","TY_(CheckHTMLTagsAttribsVersions)"],"reason":"The commit replaces recursive tree traversal with internal Stack-based iteration and adds missing TY_(freeStack) cleanup. It introduces no new public entry point, API protocol, initialization requirement, configuration option, or input constraint. Existing harnesses already exercise parsing, cleaning/repair, diagnostics, and saving, including randomized boolean configurations, so they continue to reach the changed internal paths without maintenance.","evidence":["tidy_fuzzer calls tidyParseBuffer, tidyCleanAndRepair, tidyRunDiagnostics, and tidySaveBuffer.","tidy_parse_string_fuzzer and tidy_xml_fuzzer also execute the clean-and-diagnostics pipeline on fuzzer-controlled documents.","tidy_general_fuzzer controls options including TidyMakeClean, TidyAnchorAsName, TidyStrictTagsAttr-related processing paths through parsing, and multiple output modes.","The diff changes recursive calls in TY_(FixLanguageInformation), TY_(FixAnchors), TY_(CheckHTML5), and TY_(CheckHTMLTagsAttribsVersions) to TY_(push)/TY_(pop) traversal with locally created and freed stacks.","The remaining changes only add TY_(freeStack)(stack) to existing internal traversals such as TY_(BQ2Div) and StyleToHead."],"recommended_action":"Keep the existing fuzz harnesses unchanged; no harness maintenance is justified by this internal traversal and cleanup refactor."}