{"case_id":"C073","maintenance_needed":false,"confidence":98,"change_types":["internal parser behavior change","whitespace-cleanup bug fix"],"affected_functions":["CleanLeadingWhitespace","CleanTrailingWhitespace"],"reason":"The commit only adjusts internal whitespace-cleanup decisions for adjacent body-level SCRIPT nodes. It adds no entry point, API protocol, initialization requirement, configuration, or input constraint. The existing harnesses already pass arbitrary HTML/XML input through tidyParseBuffer or tidyParseString and, notably, tidy_fuzzer, tidy_parse_string_fuzzer, and tidy_xml_fuzzer invoke tidyCleanAndRepair, which exercises the modified cleanup logic with adequate input control.","evidence":["CleanLeadingWhitespace now returns yes when node->prev is a SCRIPT whose parent is BODY.","CleanTrailingWhitespace now returns yes when node->next is a SCRIPT whose parent is BODY.","tidy_fuzzer calls tidyParseBuffer followed by tidyCleanAndRepair on arbitrary bytes.","tidy_parse_string_fuzzer and tidy_xml_fuzzer call tidyParseString followed by tidyCleanAndRepair on fuzzer-controlled strings.","The diff changes only static functions in src/parser.c and exposes no new or modified public API or setup requirement."],"recommended_action":"No harness maintenance is required; retain the existing parser-and-cleanup fuzz targets."}