{"case_id":"C076","maintenance_needed":false,"confidence":98,"change_types":["internal SIMD optimization"],"affected_functions":["decodeBytesGroupSimd","meshopt_decodeVertexBuffer"],"reason":"The commit changes only the internal calculation of the consumed-byte count in existing SIMD decoding paths. It adds the compile-time SIMD_LATENCYOPT path for supported 64-bit architectures, but does not add an entry point, alter the public decoder protocol, require new initialization or configuration, or change input constraints. The existing harness already passes arbitrary input to meshopt_decodeVertexBuffer with multiple valid strides, so it continues to exercise the changed implementation when compiled for an applicable architecture.","evidence":["The diff defines SIMD_LATENCYOPT automatically for __x86_64__, _M_X64, __aarch64__, or _M_ARM64; no harness-controlled state is introduced.","In decodeBytesGroupSimd cases 1 and 2, the return expression changes from table-based counts to data + 4/8 + datacnt, while decoding remains on the same existing function path.","The harness invokes meshopt_decodeVertexBuffer with arbitrary data and valid strides 4, 16, 24, and 32.","No public API signatures, initialization requirements, configuration inputs, or accepted stride constraints are changed."],"recommended_action":"Keep the existing fuzz harness unchanged; normal builds on supported 64-bit targets will exercise the optimized path through the existing meshopt_decodeVertexBuffer calls."}