{"case_id":"C018","maintenance_needed":true,"confidence":94,"change_types":["modified object-key semantics","expanded effective input handling"],"affected_functions":["unpack_object","json_object_update","json_object_update_missing","do_object_update_recursive","json_object_equal","json_object_copy","json_object_deep_copy"],"reason":"The commit changes several update, equality, copy, and unpack paths to preserve explicit object-key lengths instead of relying on NUL-terminated keys. This makes keys containing embedded NUL bytes a relevant input class for those paths. Although the harness can create such keys through json_loadb when JSON_ALLOW_NUL is selected, it only calls json_dumps or json_dump_callback afterward, so none of the changed update, equality, copy, deep-copy, or unpack operations are exercised.","evidence":["The harness's only high-level operations after json_loadb are json_dumps and json_dump_callback.","JSON_ALLOW_NUL is controlled by fuzz input through load_flags, allowing the harness to parse the key form implicated by the length-aware changes.","json_object_update and json_object_update_missing now use json_object_keylen_foreach plus json_object_getn/json_object_setn_nocheck.","json_object_equal, json_object_copy, and json_object_deep_copy now propagate key_len through length-aware APIs.","unpack_object replaces strlen(key) with json_object_keylen_foreach, changing handling of keys whose stored length differs from strlen."],"recommended_action":"Extend the target with input-selected modes that invoke object update/update-missing, recursive update, equality, shallow/deep copy, and object unpacking on parsed objects, while retaining JSON_ALLOW_NUL control so embedded-NUL keys reach the changed length-aware paths."}